"Status","Start Time","Stop Time","Duration in ms","Parent Suite","Suite","Sub Suite","Test Class","Test Method","Name","Description"
"passed","Thu Oct 24 10:36:59 GMT 2024","Thu Oct 24 10:36:59 GMT 2024","3","","Labels","","Delete existing label via api","","Delete existing label via api",""
"passed","Thu Oct 24 10:37:00 GMT 2024","Thu Oct 24 10:37:00 GMT 2024","3","","Milestones","","Close existing milestone for authorized user","","Close existing milestone for authorized user",""
"passed","Thu Oct 24 10:36:59 GMT 2024","Thu Oct 24 10:36:59 GMT 2024","3","","Labels","","Create new label for authorized user","","Create new label for authorized user",""
"passed","Thu Oct 24 10:37:00 GMT 2024","Thu Oct 24 10:37:00 GMT 2024","3","","Milestones","","Create new milestone for authorized user","","Create new milestone for authorized user",""
"passed","Thu Oct 24 10:36:59 GMT 2024","Thu Oct 24 10:37:00 GMT 2024","1005","","Labels","","Add label to existing issue for authorized user","","Add label to existing issue for authorized user",""
"passed","Thu Oct 24 10:36:59 GMT 2024","Thu Oct 24 10:36:59 GMT 2024","11","","Labels","","Create new label via api","","Create new label via api",""
"broken","Thu Oct 24 10:37:00 GMT 2024","Thu Oct 24 10:37:00 GMT 2024","9","","Labels","","Delete existing label for authorized user","","Delete existing label for authorized user",""
